element_idx,summarized_text,keywords
1,Tom B. Brown* Benjamin Mann* Nick Ryder* Melanie Subbiah* Jared Kaplan T Prafulla Dhariwal Arvind Neelakantan Pranav Shyam Girish Sastry Amanda Askell Sandhini Agarwal Ariel Herbert- Voss Gretchen Krueger,"benjamin, mann"
3,"Specifically, we train GPT-3, an autoregressive language model with 175 billion parameters, 10x more than any previous non-sparse language model, and test its performance in the few-shot setting . This method still requires task-specific fine-tuning datasets of thousands or tens","text, large, fine-tuning, gpt-3, corpus, few-shot, of, task-specific"
8,"Introduction 3 2 Approach 6 2.1 Model and Architectures   8 2.2 Training Dataset  9 2.4 Training Process  10 3.1 Language Modeling, Cloze, and Completion Tasks 11 3.2 Closed Book Question Answering  13 3.3 Translation  14 3.4 Winograd","reasoning, glue, sense, common, crawl, filtering"
11,"Recent years have featured a trend towards pre-trained language representations in NLP systems, applied in increasingly flexible and task-agnostic ways . First, single-layer representations were learned using word vectors and fed to task-specific architectures . then RNNs with multiple layers of representations and contextual","systems, nlp, architectures, multiple, representations, layer, task-specific"
12,"this last paradigm has led to substantial progress on many challenging NLP tasks . a major limitation to this approach is that while the architecture is task-agnostic, there is still a need for task-specific datasets . Removing this limitation would be desirable for several reasons .","task-specific, fine-tuning, nlp, architecture, datasets"
13,There exists a very wide range of possible useful language tasks . For many of these tasks it is difficult to collect a large supervised training dataset .,"examples, labeled"
14,Models are designed to be large to absorb information during pre-training . but are then fine-tuned on very narrow task distributions . For example observe that larger models do not necessarily generalize better out-of-distribution .,"model, fine-tuning, narrowness, of, paradigm, the"
21,"this adaptability has practical advantages - it allows humans to seamlessly mix together or switch between many tasks and skills . To be broadly useful, we would someday like our NLP systems to have this same fluidity and generality.","task, new, competence, quality, adaptability, of"
22,"meta-learning means model develops broad set of skills and pattern recognition abilities at training time, and then uses those abilities at inference time to rapidly adapt to or recognize the desired task .","task, model, language, specification, meta-learning"
24,In recent years the capacity of transformer language models has increased substantially . Each increase has brought improvements in text synthesis and/or downstream NLP tasks . There is evidence suggesting that log loss follows a smooth trend of improvement with scale .,"language, modeling, loss, log"
25,"the method is ""zero-shot"" in the sense that no gradient updates are performed, but it often involves providing inference-time demonstrations to the model, so is not truly learning from zero examples . To avoid this confusion, we use the term ""meta-learning"" to capture the inner-loop / outer","inference, demonstrations, training, time, inference-time"
29,"In this paper, we test this hypothesis by training a 175 billion parameter autoregressive language model . For each task, we evaluate GPT-3 under 3 conditions: ""few-shot learning"" and ""zero-shot"" learning, where no demonstrations are allowed and only an instruction in natural language is given","training, in-context, gpt-3, learning, setting, abilities"
30,Figure 1.2 illustrates the conditions we study . Model performance improves with the addition of a natural language task description . Few-shot learning also improves dramatically with model size .,"task, natural, language, learning, few-shot, description"
31,"GPT-3 achieves 81.5 F1 on CoQA in the zero-shot setting, 84.0 F1 in CoQA and 85.0 F1 . GPT3 achieves 64.3% accuracy on TriviaQA . 68.0% in the one-shot set, and 71.2% in the few-shot","achieves, state-of-the-art, gpt-3"
32,"GPT-3 also displays one-shot and few-shot proficiency at tasks designed to test rapid adaption or on-the-fly reasoning . We also show that in the short-shot setting, GPT3 can generate synthetic news articles which human evaluators have difficulty distinguishing from human-generated articles .","reasoning, gpt-3, proficiency, rapid, setting, few-shot, adaption"
33,"We also find some tasks on which few-shot performance struggles, even at the scale of GPT-3 . This includes natural language inference tasks like the ANLI dataset, and some reading comprehension datasets like RACE or QuAC.","inference, modelling, language, gpt-3, learning, few-shot"
36,"We develop systematic tools to measure data contamination and quantify its distorting effects . Data contamination has a minimal effect on GPT-3's performance on most datasets, but we do identify a few datasets where it could be inflating results .","contamination, study, common, data, crawl, systematic"
37,"the gap between zero, one-, and few-shot performance often grows with model capacity, perhaps suggesting larger models are more proficient meta-learners .","few-shot, smooth, gpt-3, scaling"
39,"In Section 2, we describe our approach and methods for training GPT-3 and evaluating it . Section 3 presents results on the full range of tasks in the zero-, one- and few-shot settings. Section 6 discusses broader impacts. Section 7 reviews related work .","contamination, gpt-3, data, train-test, overlap"
41,"Our basic pre-training approach, including model, data, and training, is similar to the process described in . Our use of in-context learning is also similar to , but in this work we systematically explore different settings for learning within the context . We start this section by explicitly defining and contrasting the different settings","in-context, gpt-3, learning"
42,Fine-Tuning has been the most common approach in recent years . It involves updating weights of a pre-trained model by training on a supervised dataset . The main advantage of fine-tuning is strong performance on many benchmarks .,"task-agnostic, performance, gpt-3, fine-tuning"
43,Few-Shot is the term we will use in this work to refer to the setting where the model is given a few demonstrations of the task at inference time as conditioning . We typically set K in the range of 10 to 100 as this is how many examples can fit in the model's context window . The main,"specific, task, fs, data, few-shot"
44,"One-Shot is the same as few-shot except that only one demonstration is allowed . It most closely matches the way in which some tasks are communicated to humans . For example, when asking humans to generate a dataset on a human worker service, it is common to give one demonstration of the task .","few-shot, zero-shot"
48,"Zero-Shot is the same as one-shot except that no demonstrations are allowed . This method provides maximum convenience, potential for robustness, and avoidance of spurious correlations . In some cases it may even be difficult for humans to understand the format of the task without prior examples .","instruction, world, natural, language, records, zero-shot"
49,"Figure 2.1 shows the four methods using the example of translating French . In this paper we focus on zero-shot, one-shot and few-shot . We aim to compare them not as competing alternatives .","few-shot, french, translation"
55,"We train 8 different sizes of model, ranging from 125 million parameters to 175 billion parameters, with the last being the model we call GPT-3 . Previous work suggests that with enough training data, scaling of validation loss should be approximately a smooth power law as a function of size .","gpt-2, loss, validation"
56,Table 2.1 shows the sizes and architectures of our 8 models . We partition the model across GPUs along both the depth and width dimension . Previous work suggests validation loss is not strongly sensitive to these parameters within a reasonably broad range .,"computational, model, loss, validation, efficiency, gpu"
58,"Datasets for language models have rapidly expanded, culminating in the Common Crawl dataset2 constituting nearly a trillion words . This size of dataset is sufficient to train our largest models without ever updating on the same sequence twice . However, unfiltered or lightly filtered versions tend to have lower quality than more curated dataset","largest, common, models, quality, crawl"
60,"Table 2.2 shows the final mixture of datasets that we used in training . The CommonCrawl data was downloaded from 41 shards of monthly commoncrawl covering 2016 to 2019, constituting 45TB of compressed plaintext before filtering . Note that during training, datasets are not sampled in proportion to their","commoncrawl, training, plaintext, compressed, datasets"
68,"a bug in the filtering caused us to ignore some overlaps, and due to the cost of training it was not feasible to retrain the model . In Section 4 we characterize the impact of the remaining overlaps .","internet, contamination, tasks, data"
70,We measure the gradient noise scale during training and use it to guide our choice of batch size . All models were trained on V100 GPU's on part of a high-bandwidth cluster provided by Microsoft . Details of the training process and hyperparameter settings are described in Appendix B .,"training, scale, larger, noise, models, gradient"
73,for LAMBADA and Storycloze there is no supervised training set available SO we draw conditioning examples from the development set and evaluate on the test set . For Winograd there is only one dataset .,"few-shot, set, learning, training"
74,"K can be any value from 0 to the maximum amount allowed by the model's context window, which is nctx = 2048 for all models . Larger values of K are usually but not always better, SO when a separate development and test set are available . For some tasks we also use a","appendix, g, test, set"
75,"On tasks that involve choosing one correct completion from several options, we provide K examples of context plus correct completion . On a small number of datasets we gain additional benefit as measured on the development set P by normalizing by the unconditional probability of each completion.","correct, completion, answer"
78,Final results are reported on the test set when publicly available . We submit to the test server on a small number of datasets where we were able to make submission work .,"learning, test, setting, set, work"
80,In Figure 3.1 we display training curves for the 8 models described in Section 2 . Language modeling performance follows a power-law when making efficient use of training compute . One might worry that these improvements come only from modeling spurious details of our training corpus .,"training, cross-entropy, curves, loss"
82,In Section 3.1 we evaluate on traditional language modeling tasks and tasks similar to language modeling . We evaluate on Cloze tasks and sentence/paragraph completion tasks . In Section 3.3.2 we evaluate the model's performance on Winograd Schema-like tasks in Section 3.5 .,"answering, question, tasks"
91,We calculate zero-shot perplexity on the Penn Tree Bank dataset measured in . We also omit the one-billion word benchmark due to a high fraction of the dataset being contained in our training data . PTB escapes these issues due to predating the modern internet .,"ptb, zero-shot, dataset"
93,LAMBADA dataset tests the modeling of long-range dependencies in text . the model is asked to predict the last word of sentences which require reading a paragraph of context .,"lambada, long-range, dataset, dependencies"
100,LAMBADA is a demonstration of the flexibility of few-shot learning . It provides a way to address a problem that classically occurs with this dataset . a standard language model has no way of knowing this detail .,"learning, lambada, flexibility, few-shot, of"
102,GPT-3 achieves 86.4% accuracy in the few-shot setting . This is an increase of over 18% from the previous state-of-the-art .,"few-shot, method, gpt-3, setting, fill-in-blank"
108,HellaS wag dataset involves picking the best ending to a story or set of instructions . GPT-3 achieves 78.1% accuracy in one-shot setting and 79.3% accuracy in few shots .,"model, wag, hellas, dynamics, dataset"
112,In this section we measure GPT-3's ability to answer questions about broad factual knowledge . This task has normally been approached by using an information retrieval system to find relevant text in combination with a model which learns to generate an answer given the question and the retrieved text . They denote this more restrictive evaluation setting,"system, questions, gpt-3, retrieval, information"
113,"TriviaQA achieves 64.3% in the zero-shot setting, 68.0% in the one-shot set, and 71.2% in the few-shot settings . GPT-3's result already outperforms the fine-tuned T5-11B by 14.2% .","gpt-3, t5-11b"
114,GPT-3 achieves 14.4% in the zero-shot setting . This compares to 37.4% for fine-tuned T5-11B+SSM . WebQuestions shows a much larger gain compared to TriviaQA .,"gpt-3, fine-tuned, models, setting, few-shot, state-of-the-art"
119,"On Natural Questions GPT-3 achieves 14.6% in zero-shot setting, 23.0% in one-shot set, and 29.9% in few-shot . Similar to WebQS, the large gain from zero-to-need-shot may suggest a distribution shift .","natural, nqs, questions, gpt-3"
120,GPT-3's one-shot matches the open-domain fine-tuning SOTA . On the other two datasets it approaches the performance of the closed-book .,"sota, fine-tuning, open-domain, gpt-3, closed-book"
122,"GPT-2 showed some evidence of multilingual capability and performed non-trivially when translating between French and English despite only training on 10 megabytes of remaining French text . Since we increase the capacity by over two orders of magnitude, we also expand the scope of the training dataset to include more representation of other languages .","capability, gpt-2, multilingual, filtering, collection, dataset"
123,Existing unsupervised machine translation approaches often combine pretraining on a pair of monolingual datasets with back-translation . GPT-3 also uses a single training objective which is not customized or designed for any task in particular .,"gpt-3, pretraining, back-translation, combine, monolingual, datasets"
135,"Performance on En-Ro is a noticeable outlier at over 10 BLEU worse than prior unsupervised NMT work . For both Fr-En and De-En, few shot GPT-3 outperforms the best supervised result we could find .","backtranslation, gpt-3"
145,On Winograd we test GPT-3 on the original set of 273 Winograde schemas . This setting differs slightly from the WSC task in the SuperGLUE benchmark . The results show no clear in-context learning .,"dynamics, state-of-the-art, gpt-3"
148,"GPT-3 achieves 81.0% accuracy zero-shot, 80.5% accuracy one-shot and 82.8% accuracy few-shot . This compares favorably to the 79.4% accuracy prior state-of-the-art .","world, physical, reasoning, gpt-3, accuracy, works"
152,PIQA shows relatively shallow scaling with model size . GPT-3's few-shot and even zero-shot result outperform the current state-of-the-art .,"fire-tuned, gpt-3, roberta"
153,"ARC is a dataset of multiple-choice questions collected from 3rd to 9th grade science exams . On the ""Challenge"" version of the dataset, GPT-3 achieves 51.4% accuracy in the zero-shot setting . This is approaching the performance of a fine-tuned Ro","question, arc, questions"
157,"We use a suite of 5 datasets including abstractive, multiple choice, and span based answer formats in both dialog and single question settings . In general we observe GPT-3 is on par with initial baselines and early results trained using contextual representations on each dataset .","answ, formats, gpt-3"
158,"GPT-3 performs best on CoQA a free-form conversational dataset and performs worst on QuAC . On SQuAD 2.0, GPT3 demonstrates its few-shot learning capabilities . This allows it to slightly outperform the best fine-tuned result in the original paper .","bert, baseline, comprehension, gpt-3"
160,"GPT-3's test-set performance on the SuperGLUE dataset is shown in Table 3.8 . In the few-shot setting, we used 32 examples for all tasks, sampled randomly from the training set .","tasks, nlp, superglue, gpt-3, benchmark"
170,"On COPA and ReCoRD GPT-3 achieves near-SOTA performance in the one-shot and few-shot settings . On WSC, performance is reasonable, roughly matching that of a fine-tuned BERT-Large . We see signs of life at 75.6% in the few-","few-shot, gpt-3, setting"
171,WiC is a notable weak spot with few-shot performance at 49.4% . We tried a number of different phrasings and formulations for WiC . This hints at a phenomenon that will become clearer .,"few-shot, weak, spot, gpt-3"
172,GPT-3 requires less than eight total examples per task to outperform a fine-tuned BERT-Large on overall SuperGLUE score .,"superglue, gpt-3, score"
178,"SuperGLUE includes an NLI dataset, RTE, which evaluates the binary version of the task . On RTE only the largest version of GPT-3 performs convincingly better than random in any evaluation setting, but in a few-shot setting GPT3 performs similarly to a single-task fine-t","inference, large, natural, language, bert, rte, adversarially, mined"
180,"We test GPT-3's ability to perform simple on-the-fly computational reasoning . Second, we create several tasks that involve rearranging or unscrambling the letters in a word . Third, we test the ability to solve SAT-style analogy problems few shots .","qualitative, tasks, gpt-3"
183," 2 digit addition - The model is asked to subtract two integers sampled uniformly from [0, 100); the answer may be negative . Example: ""Q: What is 34 minus 53? A: -19""","subtraction, addition, number"
187," 4 digit addition - Same as 3 digit subtraction, except uniformly sampled from [0, 10000).  5 digit multiplication - The model is asked to multiply two integers sampled uniformly from[0, 100), e.g. ""Q: What is 24 times 42","multiplication, operation, composite"
189,"GPT-3 displays strong proficiency when the number of digits is small . Performance decreases as number increases, but GPT 3 still achieves 25-26% accuracy on four digit operations and 9-10% accuracy on five digit operation . GPT3 also achieves 29.2% accuracy at 2 digit multiplication,","gpt-3, number, digits, setting, few-shot, of"
198,"We took the 3-digit arithmetic problems and searched for them in our training data . Out of 2,000 addition problems we found only 17 matches . In addition, inspection of incorrect answers reveals that the model often makes mistakes .","problems, memorizing, memorization, table, arithmetic"
202,"The model is given a word with its letters cycled, then the ""="" symbol, and is expected to generate the original word . For example, it might be given ""lyinevitab"" and should output ""inevitably""","words, cycle, cycled, letters"
208,performance is significantly weaker in the one-shot setting . model can rarely perform any of the tasks at test time . artificial nature makes them unlikely to appear in pre-training data .,"zero-shot, model, setting"
209,"""in-context learning curves"" show task performance as a function of the number of examples . We can see that larger models are able to make increasingly effective use of in-constext information .","in-context, curves, learning"
210,"LM's perspective succeeding at these tasks involves not just manipulating BPE tokens but understanding and pulling apart their substructure . CL, A1 and A2 are not bijective , requiring the model to perform some search to find the correct unscrambling .","unscrambled, bpe, word, unscrambling, correct"
212,"GPT-3 achieves 65.2% in few shots, 59.1% in one-shot setting, and 53.7% in zero-shot . The average score among college applicants was 57% .","analysis, analogy, gpt-3, qua, quality, of, the"
217,"Previous work on generative language models qualitatively tested their ability to generate synthetic ""news articles"" by conditional sampling from the model given a human-written prompt consisting of a plausible first sentence for a news story . To solve this problem we employed GPT-3's few-shot learning abilities .","gpt-3, sampling, conditional, articles, news"
218,Generative language models are trained to match the distribution of content generated by humans . The ability of humans to distinguish the two is a potentially important measure of quality .,"sample, gpt-3, conditional, quality, articles, generation, news, of"
219,"In order to see how well humans can detect model generated text, we arbitrarily selected 25 article titles and subtitles from the website newser.com . For each model, we presented around 80 US-based participants with a quiz consisting of these real titles . Participants were asked to select whether the article was ""very likely","machine, subtitles, model, human, a"
220,Model outputs were formatted and selected programmatically to prevent human cherry-picking . All models used same context to condition outputs on and were pre-trained with same context size and the same article titles and subtitles were used as prompts .,"model, control, cherry-picking, output, randomness"
226,"Mean human accuracy at detecting that the intentionally bad articles were model generated was  86% where 50% is chance level performance . Human abilities to detect model generated text appear to decrease as model size increases, and human detection of GPT-3 is close to chance .","size, model, text, human, gpt-3, generated, accuracy, increases, mean"
227,"Factual inaccuracies can be an indicator that an article is model generated . Other indicators include repetition, non sequiturs, and unusual phrasings .","authentic, human, gpt-3, articles, synthetic, content"
229,"To do a preliminary investigation of how good humans are at detecting longer news articles generated by GPT-3 175B, we selected 12 world news articles from Reuters with an average length of 569 words . Ippolito et al. also note that human accuracy in detecting model generated text increases as humans observe","model, control, gpt-3, longer, news"
230,"Mean human accuracy at detecting the intentionally bad longer articles was  88%, while mean human accuracy was barely above chance at  52% . This indicates that, for news articles that are around 500 words long, GPT-3 continues to produce articles that humans find difficult to distinguish from human written news articles .","gpt-3, written, longer, articles, news"
232,"a task studied in developmental linguistics is the ability to learn and utilize new words . We give GPT-3 the definition of a nonexistent word, such as ""Gigamuru"" we ask it to use it in a sentence .","linguistics, gpt-3, ability, value, developmental"
233,"6If a model consistently produces texts that are more impressive than human articles, it is possible that human performance on this task would drop below 50% .","t-test, student’s, model, control, appendix, f., two-sample"
240,"United Methodists agree to a historic split - one that is expected to end in the creation of a new denomination . The majority of delegates voted to strengthen a ban on the ordination of LGBTQ clergy and to write new rules that will ""discipline"" clergy who officiate at same-sex","christian, church, marriage, methodist, united, gay, the"
244,"Joaquin Phoenix appeared on the red carpet wearing a tuxedo with a paper bag over his head that read, ""I am a shape-shifter. I can 't change the world. I "" It was a promise to not change to fit into the can only change myself .","joaquin, film, phoenix"
248,"To do a ""farduddle"" means to j ump up and down really fast . A ""yalubalu"" is a type of vegetable that looks like a big pumpkin .",africa
255,"Boldface is GPT-3's completions, plain textis human prompts . In the first example both the prompt and the completion are provided by a human . This serves as conditioning for subsequent examples .","gpt-3, prompt, plain, textis, completions"
256,"Table 3.16 shows the 6 examples we generated; all definitions were human-generated . In all cases the generated sentence appears to be a correct or at least plausible use of the word . Overall, GPT-3 seems to be at least proficient at the task of using novel words .","word, screeg, gpt-3, nonexistent"
260,Accurately detecting test contamination from internet-scale datasets is a new area of research without established best practices . This issue is becoming increasingly important to attend to .,"contamination, internet-scale, benchmark, sets, test, datasets"
263,Poor English input : I eated the purple berries . Good English output : Thank you for choosing me as your designer . I'd appreciate it . Poor English output: The mentioned changes have done . or I did the alteration that you requested .,"it, purple, berries, appreciate"
277,"GPT-3's completions, plain text is human prompts . This serves as conditioning for subsequent examples . The distinction between ""poor"" and ""good"" English is complex, contextual, and contested .","text, correcting, english, gpt-3, plain"
282,"GPT-3 175B does not overfit its training set by a significant amount, measured relative to a held-out validation set with which it was deduplicated . We expect that contamination is likely to be frequent, but that its effects may not be as large as feared .","contamination, validation, gpt-3, memorization, set"
283,"a bug resulted in only partial removal of all detected overlaps . Due to the cost of training, it wasn't feasible to retrain the model . To address this, we investigate in detail how the remaining detected overlap impacts results.","training, contamination, data"
