element_idx,summarized_text,keywords
284,"For each benchmark, we produce a 'clean' version which removes all potentially leaked examples, defined roughly as examples that have a 13-gram overlap with anything in the pretraining set .","appendix, clean, c, subset"
285,"We then evaluate GPT-3 on these clean benchmarks and compare to the original score . If the score on the clean subset is lower, this suggests contamination may be inflating the results .","contamination, performance, benchmarks, gpt-3, difference, clean"
292,"We found 25% of the examples in the WMT16 German-English test set were marked as potentially contaminated, with an associated total effect size of 1-2 BLEU . After inspecting the flagged overlaps, we found that they were not typically instances of real reversals or unscramblings in the training","analysis, subset, workplace, clean, overlap"
294,"We found the 4 Wikipedia language modeling benchmarks measured in GPT-2 plus the Children's Book Test dataset to be almost entirely contained in our training data . We do not report results on these datasets, even though we intended to when starting this work .","bank, gpl, tree, common"
295,"We also inspected datasets where contamination was high, but the impact on performance was close to zero, simply to verify how much actual contamination existed . One notable exception was LAMBADA, which appeared to have substantial genuine contamination . The clean subset scored within 0.5% of the full dataset .","contamination, scoring, lambada, actual, subset, clean, cle"
296,the clean subset is not drawn from the same distribution as the original dataset . The sheer number of shifts close to zero suggests this is unlikely . We also observed no noticeable difference in the shifts for small models .,"analysis, contamination, memorization, subset, clean"
297,"We have made a best effort to measure and document the effects of data contamination, and to note or outright remove problematic results . Much work remains to be done to address this important and subtle issue for the field in general .","contamination, appendix, benchmarks, field, c, data"
300,"We will release a collection of 500 uncurated unconditional samples to help provide a better sense of GPT-3's limitations and strengths at text synthesis . In the domain of discrete language tasks, we have noticed informally that GPT3 seems to have special difficulty with ""common sense physics"" Specifically, G","nlp, gpt-3, quality, of, the"
301,"GPT-3 has several structural and algorithmic limitations, which could account for some of the issues above . We focused on exploring in-context learning behavior in autoregressive language models . As a result our experiments do not include any bidirectional architectures or other training objectives such as denoising . Thus our design","model, fine-tuning, passage, bidirectional, long"
304,"Our current objective weights every token equally and lacks a notion of what is most important to predict and what is less important . Also, with self-supervised objectives, task specification relies on forcing the desired task into a prediction problem . Finally, useful language systems might be better thought of as taking goal-directed actions rather","customizing, objective, world, function, pretraining, of, the"
305,GPT-3 takes a step towards test-time sample efficiency . It still sees much more text during pre-training than a human sees in their lifetime .,"model, language, efficiency, test-time, gpt-3, pre-training, sample"
306,few-shot learning in GPT-3 may vary from task to task . Synthetic tasks such as wordscrambling or defining nonsense words seem especially likely to be learned de novo . Even organizing diverse demonstrations during pre-training is an advance for language models .,"task, gpt-3, organization, learning, few-shot"
307,"a limitation associated with models at the scale of GPT-3 is that they are both expensive and inconvenient to perform inference on . Large models contain a very wide range of skills, most of which are not needed for a specific task . Distillation is well-explored in general but has not been","tasks, large, distillation, gpt-3, models, specific"
308,"GPT-3 shares some limitations common to most deep learning systems . its decisions are not easily interpretable, it is not necessarily well-calibrated in its predictions on novel inputs . This last issue - biases in the data that may lead the model to generate stereotyped or prejudiced content - is of special","system, gpt-3, biases, learning"
310,Language models have a wide range of beneficial applications for society . GPT-3 improves the quality of text generation and adaptability over smaller models and increases the difficulty of distinguishing synthetic text from human-written text .,"text, language, gpt-3, autocompletion, and, code, models, writing, synthetic"
311,"Here we focus on the potential harms of improved language models . We focus on two primary issues: the potential for deliberate misuse of language models like GPT-3 in Section 6.1, and issues of bias, fairness, and representation within models like this .","language, gpt-3, models, improved, representation"
314,"Malicious uses of language models can be difficult to anticipate because they involve repurposing language models in a very different environment or for a different purpose than researchers intended . To help with this, we can think in terms of traditional security risk assessment frameworks, which outline key steps such as identifying threats and potential impacts","likelihood, applications, misuse, potential"
316,"Language models that produce high quality text generation could lower existing barriers to carrying out these activities . Examples include misinformation, spam, phishing, abuse of legal and governmental processes, fraudulent academic essay writing and social engineering pretexting .","models, language, quality, text"
320,"low and mid-skill actors think about language models . We have been monitoring forums and chat groups where misinformation tactics, malware distribution, and computer fraud are frequently discussed .","language, gpt-2, models"
321,Since the release of GPT-2 there has been no discernible difference in operations . The assessment was that language models may not be worth investing significant resources in .,"text, apt, language, models, for, generating"
323,"phishing is extremely popular among all groups because it offers a low-cost, low-effort, high-yield method of deploying malware and stealing login credentials . Using language models to augment existing TTPs would likely result in an even lower cost of deployment .","ttps, procedures, phishing, deployment, techniques"
324,"Having stable infrastructure has a large impact on the adoption of TTPs . The outputs of language models are stochastic, but developers can constrain them . If a social media disinformation bot produces outputs that are reliable 99% of the time, but incoherent outputs 1%, this could reduce","ease, truncation, use, top-k, ttp, of"
325,"AI researchers will eventually develop language models that are consistent and steerable that they will be of greater interest to malicious actors . We expect this will introduce challenges for the broader research community and hope to work on this through a combination of mitigation research, prototyping, and coordinating with other technical developers.","model, landscape, ai, actors, research"
328,"Biases present in training data may lead models to generate stereotyped content . This is concerning, since model bias could harm people in relevant groups in different ways .","stereotypes, bias, model"
330,Our analysis indicates that internet-trained models have internet-scale biases . We probe for bias in the 175 billion parameter model and also in smaller models .,"bias, internet-scale, internet-training, internet-trained, models"
332,"83% of the 388 occupations we tested were more likely to be followed by a male gender identifier by GPT-3 . We measured this by feeding the model a context such as ""The detective was a "" .","bias, gpt-3, identif, gender"
333,"We also tested how these probabilities changed when we shifted the context to be the ""The competent occupation was a"" for each occupation in the dataset . We found that when prompted with ""the competent 'occupationwas a, the majority of occupations had an even higher probability of being followed by ","male, {occupation], identifier, competent, ma"
334,"One method measured models' ability to correctly assign a pronoun as the occupation or the participant . For example, we fed the model a context such as ""The advisor met with the advisee because she wanted to get advice about job applications .","advisor, resolution, advisee, pronoun"
335,GPT-3 175B had the highest accuracy of all the models on this task . It was also the only model where the accuracy for Occupant sentences for females was higher than for males .,"sentences, words, occupation, gpt-3, participant, 17b"
341,"females were more often described using appearance oriented words such as ""beautiful"" compared to men who were more frequently described using adjectives that span a greater spectrum .",adverbs
342,"Table 6.1 shows the top 10 most favored descriptive words for the model . The raw number of times each word co-occurred with a pronoun indicator is ""Most Favored""","words, qualifying, co-occurrences"
344,"To investigate racial bias in GPT-3, we seeded the model with prompts such as ""The race man was very"" We measured word co-occurrences in the generated samples . We measured sentiment using Senti WordNet for the words which co-occurred disproportionately with each","bias, bes10, senti, gpt-3, wordnet, racial"
345,resulting sentiment can reflect socio-historical factors . text relating to a discussion of slavery will often have a negative sentiment . this may lead to demographic being associated with negative sentiment under this testing methodology.,"slavery, sentiment, negative"
346,"'Asian' had a consistently high sentiment - it ranked 1st in 3 out of 7 models . On the other hand, 'Black' had an consistently low sentiment . These differences narrowed marginally on the larger model sizes . This analysis gives a sense of the biases of","analysis, highlights"
354,We generated 800 model outputs of length 50 with a temperature of 1 and a top p of 0.9 for every prompt . We then allowed the model to naturally carry out completions and created a corpus of such completions .,"atheism, buddhism"
357,"models make associations with religious terms that indicate some propensity to reflect how these terms are sometimes presented in the world . For example, with the religion Islam, we found that words such as ramadan, prophet and mosque co-occurred at a higher rate than for other religions .",islam
360,"We have presented this preliminary analysis to share some of the biases we found in order to motivate further research . We view the work in this section as subjective signposting - we chose gender, race, and religion as a starting point .","reporting, model, models, biases"
361,"We offer only a few brief comments on future directions specific to large language models . In order to pave the way for effective bias prevention in general purpose models, there is a need for building a common vocabulary tying together normative, technical and empirical challenges of bias mitigation .","language, mitigation, systems, bias"
364,Models like GPT-3 consume significant resources during training . generating 100 pages of content from a trained model can cost on the order of 0.4 kW-hr . techniques like model distillation can further bring down the cost of such models .,"large-scale, models, pre-training, gpt-3"
366,"An early work scaled LSTM based language models to over a billion parameters . One line of work straightforwardly increases the size of transformer models, scaling up parameters and FLOPS-per-token roughly in proportion . This approach rely on the conditional computation framework .","lstm, performance, task, count, computation, increasing, parameter"
367,Several efforts have also systematically studied the effect of scale on language models . find a smooth power-law trend in loss as autoregressive language models are scaled up .,"model, power-law, language, smooth, trend"
371,fine-tuned language models have neared human performance on many standard benchmark tasks . in this work we test our models on many of these datasets .,"language, tasks, models, benchmark"
372,"Many previous efforts have focused specifically on question-answering . Recent efforts include , which fine-tuned an 11 billion parameter language model . Our work differs in focusing on in-context learning .","in-context, question-answering, learning"
373,Metalearning in language models has been used in . Language model metalearning has an inner loop-outer-loop structure . Our approach of stuffing the model's context with previous examples is most structurally similar to RL2 .,"estimation, density, models, ml, metalearning"
375,giving multi-task models instructions in natural language was first formalized in a supervised setting with and utilized for some tasks in . the concept of presenting tasks in natural languages was also explored in the text-to-text transformer .,"multi-task, models"
376,"Multi-task learning fine-tunes on a mixture of downstream tasks together, rather than separately updating the weights for each one . Multitask learning has shown some promising initial results . This is limited by the need to manually curate datasets and set up training curricula .","capability, multi-task, transfer-learning, learning"
377,"Algorithmic innovation in language models over the last two years has been enormous, including denoising-based bidirectionality , prefixLM and encoder-decoder architectures . Many of these techniques provide significant gains on downstream tasks . In this work we continue to focus on pure autoregressive language models","implementation, model, large, fine-tuning, gpt-3, setting"
381,"state-of-the-art fine-tuned systems generate high-quality samples . We also discussed the social impacts of this class of model . These results suggest that very large language models may be an important ingredient in the development of adaptable, general language systems.","state-of-the-art, fine-tuning, model"
383,"authors would like to thank Ryan Lowe for giving detailed feedback on draft paper . Thanks to Jakub Pachocki and Szymon Sidor for suggesting tasks, and Greg Brockman, Michael Petrov, Brooke Chan, and Chelsea Voss for helping run evaluations on OpenAI's infrastructure .","visual, model, openai, design"
415,Classifier is trained using logistic regression classifier with features from Spark's standard tokenizer and HashingTF 10 . We then used this classifier to re-sample Common Crawl by prioritizing documents predicted to be higher quality .,"regression, logistic, raw, common, classifier, crawl"
417,a was chosen to match the distribution of scores from our classifier on WebText . We found this re-weighting increased quality as measured by loss on a range of out-of-distribution text samples .,"model, quality, classifier, webtext, capacity"
420,"To train all versions of GPT-3, we use Adam with B1 = 0.9, B2 = 0.95, and E = 10-8 . There is a linear LR warmup over the first 375 million tokens . All models use weight decay of 0.1 to provide a small amount of regularization ","training, learning, gpt-3, rate"
421,We train on sequences of the full nctx = 2048 token context window . Sequences with multiple documents are delimited with a special end of text token . This allows for efficient training without need for any special sequence-specific masking .,"computational, training, efficiency, documents, multiple"
424,"Initial training set filtering We tried to remove text occurring in benchmarks from training data by searching for 13-gram overlaps . For filtering purposes we define a gram as a lowercase, whitespace delimited word with no punctuation . Documents split into more than 10 pieces were considered contaminated .","workplace, filtering, whitespace, set"
427,"Originally we removed entire documents given a single collision, but that overly penalized long documents such as books for false positives . An example of a false positive might be a test set based on Wikipedia . We ignored 13- grams that matched more than 10 training documents .","repository, release, documents, collision, gpt-3, entirely, 11, long, single"
428,"We used a variable number of words N to check for overlap for each dataset . For performance reasons, we set a maximum value of 13 for all tasks . Values for N and the amount of data marked as dirty are shown in Table C.1.","spark, apache, benchmark, overlap, methodology"
430,"Test and validation splits had similar contamination levels . Due to a bug revealed by this analysis, filtering described above failed on long documents such as books .","validation, children’s, book, test, filtering"
431,"if the clean score is more than 1% or 2% worse than the overall score, it suggests the model may have overfit to the examples it has seen .","examples, clean, score, clean-only"
432,DROP is a reading comprehension task in which 94% of the examples are dirty . The information required to answer the question is in a passage provided to the model .,"wordscrambling, drop, passage, source, dataset"
437,"""Relative Difference Clean VS All"" shows the percent change in performance between only the clean examples VS all the examples in the benchmark . ""Clean percentage"" is the percent of examples that are clean VS total .","clean, percentage, cle"
443,"T5 uses an encoder-decoder model, only half of the parameters are active for each token during a forward or backwards pass . Then we add a multiplier of dparams dacts similar amount of compute as the 3x .","model, training, encoder-decoder, t5, tokens"
446,97 participants excluded for failing an internet check question . Mean participant age was  38 years old . All participants were US-based but there were no other demographic restrictions .,"internet, check, participation, question"
447,We arbitrarily selected 25 news articles that appeared in newser.com in early 2020 . Five outputs per question were generated by each model and the generation with a word count closest to that of the human written article was selected automatically .,"model, each, procedure, early, output, 2020"
454,Each quiz consisted of 25 articles: half were human written and half were model generated . The order of quiz question was shuffled for each participant . Participants were instructed not to look up the articles or their content during the quiz .,"quiz, question"
455,"Statistical Tests: To compare means on the different runs, we performed a two-sample t-test for independent groups . This was implemented in Python using the scipy  stats  ttest_ind function .","control, two-sample, python, t-test"
461,We recruited 160 unique US-based participants to take part in 2 experiments through Positly . We then used the article titles and Reuters locations to generate completions from GPT-3 175B .,"model, world, control, word, gpt-3, 175b, news"
463,"In Figure F.1, we show four uncurated samples from a prompt suggesting that the model write a poem, with a given title, in the style of Wallace Stevens . Completions were truncated when the model began to write an author heading .","heading, sampling, gpt-3"
465,The City BY C. P. CAVAFY TRANSLATED BY EDMUND KEELEY SOME TREES John Ashbery Shadows on the Way Wallace Stevens Generated Poem 1 Generated poem 3 I must have All is changed . The mind must dwell on those Each step,wood
473,The Gold Coast is located one mile west of Las Vegas Strip on West Flamingo Road . It is located across the street from Palms Casino Resort and Rio All Suite Hotel and Casino .,"neither, nei, gold, coast"
497,"There are three levels within MultiRC: the passage, the questions, and the answers . During evaluation, accuracy is determined at the per-question level . For this reason, we use K to refer to the number of questions shown within the context.","multirc, questions, level"
580,"The second PASCAL recognising textual entailment challenge. 2006. Yonatan Bisk, Ari Holtzman, Bill Dolan, Lisa Ferro, Danilo Giampiccolo, Bernardo Magnini, and Idan Szpektor . ArXiv preprint ar","question, natural, language, answer, y"
582,"In Machine learning challenges. evaluating predictive uncertainty, visual object classification, and recognising textual entailment, pages 177-190. Springer, 2006. Mostafa Dehghani, Stephan Gouws, Oriol Vinyals, Jakob Uszkoreit, and Lu","inference, natural, language, transformers, back-translation"
584,"Deep learning scaling is predictable, empirically . arXiv preprint arxiv:1801.06146, 2018. Sepp Hochreiter, A Steven Younger, and Peter R Conwell. Learning to Learn Using Gradient Descent. In International Conference on Artificial Neural Networks, pages 87-","answering, question, modeling, natural, language, bert"
586,"Xiaodong Liu, Hao Cheng, Pengcheng He, Weizhu Chen, Yu Wang, Hoifung Poon, and Jianfeng Gao . Multilingual denoising pre-training for neural machine translation .","understanding, natural, language, bert, translation"
588,"Bryan McCann, Nitish Shirish Keskar, Caiming Xiong, and Richard Socher . Learned in translation: Contextualized word vectors . A corpus and evaluation framework for deeper understanding of commonsense stories.","natural, language, inference, representation"
590,"In Proceedings of the 2014 conference on empirical methods in natural language processing, 2014. QIANXIN. Sa-net on albert , April 2020. Yusu Qian, Urwa Muaz, Ben Zhang, and Jae Won Hyun. Reducing gender bias in word-level language models with ","bias, model, gender, function, emnlp, language, generation, word-level"
592,"A simple method for commonsense reasoning. In Advances in neural information processing systems, pages 3630-3638, 2016. Rowan Zellers, Ari Holtzman, Yonatan Bisk, Ali Farhadi, Franziska Roesner, and Yejin Choi. Attention is all you need","systems, analysis, analogy, communication, processing, information, technical"
